ID;Tema;Domanda;Tipologia;Risposte;Difficoltà;Data creazione
AVTR00001;Avatar;Chi ha diretto il film "Avatar" (2009)?;4 risposte;A) Steven Spielberg, B) Peter Jackson, @C) James Cameron, D) Ridley Scott;⭐⭐;14/12/2025
AVTR00002;Avatar;In che anno è uscito il primo film "Avatar"?;4 risposte;A) 2005, @B) 2009, C) 2012, D) 2015;⭐⭐;14/12/2025
AVTR00003;Avatar;Qual è il nome del pianeta dove si svolge la storia?;4 risposte;A) Pandora, B) LV-426, @C) Pandora, D) Arrakis;⭐;14/12/2025
AVTR00004;Avatar;Il protagonista umano che diventa Na'vi si chiama Jake Sully.;Vero/Falso;@Vero, Falso;⭐;14/12/2025
AVTR00005;Avatar;Scrivi il nome della protagonista Na'vi che guida Jake.;Risposta aperta;@Neytiri;⭐⭐;14/12/2025
AVTR00006;Avatar;Quale corporazione è responsabile delle operazioni su Pandora?;4 risposte;A) Tyrell Corporation, @B) RDA (Resources Development Administration), C) Weyland-Yutani, D) OmniCorp;⭐⭐;14/12/2025
AVTR00007;Avatar;Chi interpreta Jake Sully nel film?;4 risposte;A) Sam Worthington, B) Matt Damon, @C) Sam Worthington, D) Chris Pratt;⭐⭐;14/12/2025
AVTR00008;Avatar;La lingua Na'vi è stata creata appositamente per il film.;Vero/Falso;@Vero, Falso;⭐⭐;14/12/2025
AVTR00009;Avatar;Chi ha creato la lingua Na'vi?;4 risposte;A) J.R.R. Tolkien, @B) Paul Frommer, C) Marc Okrand, D) David J. Peterson;⭐⭐⭐;14/12/2025
AVTR00010;Avatar;Qual è il nome dell'albero sacro dei Na'vi?;4 risposte;A) Albero della Vita, B) Albero del Mondo, @C) Albero delle Anime (Tree of Souls), D) Albero di Eywa;⭐⭐;14/12/2025
AVTR00011;Avatar;Il compositore della colonna sonora del primo film è James Horner.;Vero/Falso;@Vero, Falso;⭐⭐;14/12/2025
AVTR00012;Avatar;Chi interpreta la dottoressa Grace Augustine?;4 risposte;A) Zoe Saldana, B) Michelle Rodriguez, @C) Sigourney Weaver, D) Kate Winslet;⭐⭐;14/12/2025
AVTR00013;Avatar;Scrivi il nome del comandante militare antagonista nel primo film.;Risposta aperta;@Colonel Miles Quaritch;⭐⭐;14/12/2025
AVTR00014;Avatar;Quale tecnica è stata ampiamente usata per catturare le performance degli attori?;4 risposte;A) Stop motion, B) Animazione tradizionale, @C) Motion capture, D) Rotoscoping;⭐⭐;14/12/2025
AVTR00015;Avatar;Il Toruk è una creatura volante leggendaria tra i Na'vi.;Vero/Falso;@Vero, Falso;⭐⭐;14/12/2025
AVTR00016;Avatar;Quale studio ha curato gran parte degli effetti visivi del primo film?;4 risposte;A) Industrial Light & Magic, @B) Weta Digital, C) Pixar, D) DreamWorks Animation;⭐⭐⭐;14/12/2025
AVTR00017;Avatar;Scrivi il nome del regista che ha diretto anche "Titanic".;Risposta aperta;@James Cameron;⭐⭐;14/12/2025
AVTR00018;Avatar;Il primo "Avatar" è stato distribuito in 3D su larga scala.;Vero/Falso;@Vero, Falso;⭐⭐;14/12/2025
AVTR00019;Avatar;Quale tema centrale è esplorato nel film?;4 risposte;A) Viaggi nel tempo, B) Commedia romantica, @C) Conflitto tra colonizzatori e popolazioni indigene, D) Sport competitivo;⭐⭐;14/12/2025
AVTR00020;Avatar;Chi è il creatore del design biologico del mondo di Pandora (concept art principale)?;4 risposte;A) H.R. Giger, B) Ron Cobb, @C) James Cameron con il suo team di concept, D) Hayao Miyazaki;⭐⭐;14/12/2025
AVTR00021;Avatar;Scrivi il nome della figlia di Jake e Neytiri apparsa nei sequel.;Risposta aperta;@Neteyam (o altri figli a seconda del film) ;⭐⭐⭐;14/12/2025
AVTR00022;Avatar;"Avatar: The Way of Water" è il titolo del secondo film della saga.;Vero/Falso;@Vero, Falso;⭐⭐;14/12/2025
AVTR00023;Avatar;In che anno è uscito "Avatar: The Way of Water"?;4 risposte;A) 2018, B) 2020, @C) 2022, D) 2024;⭐⭐;14/12/2025
AVTR00024;Avatar;Quale elemento tecnologico è centrale per il concetto di "avatar" nel film?;4 risposte;A) Clonazione, B) Viaggi nel tempo, @C) Corpo biologico controllato a distanza (avatar), D) Realtà virtuale pura;⭐⭐;14/12/2025
AVTR00025;Avatar;La mitologia di Eywa rappresenta una rete vivente che connette Pandora.;Vero/Falso;@Vero, Falso;⭐⭐;14/12/2025
AVTR00026;Avatar;Chi ha composto la colonna sonora di "Avatar: The Way of Water"?;4 risposte;A) Hans Zimmer, @B) Simon Franglen (con temi di James Horner), C) John Williams, D) Alan Silvestri;⭐⭐⭐;14/12/2025
AVTR00027;Avatar;Scrivi il nome della razza umanoide nativa di Pandora.;Risposta aperta;@Na'vi;⭐;14/12/2025
AVTR00028;Avatar;Quale tecnologia militare è usata dagli umani su Pandora?;4 risposte;A) Mecha e veicoli armati (AMP suits), B) Teletrasporto, C) Navi stellari invisibili, D) Armi magiche;@A) Mecha e veicoli armati (AMP suits);⭐⭐;14/12/2025
AVTR00029;Avatar;Il termine "avatar" nel film indica un corpo Na'vi controllato da un umano.;Vero/Falso;@Vero, Falso;⭐;14/12/2025
AVTR00030;Avatar;Chi è il produttore esecutivo e fondatore della saga insieme a James Cameron?;4 risposte;A) Jon Landau, @B) Jon Landau, C) Kathleen Kennedy, D) Gale Anne Hurd;⭐⭐;14/12/2025
AVTR00031;Avatar;Scrivi il nome del luogo sacro dove i Na'vi comunicano con Eywa.;Risposta aperta;@Albero delle Anime (Tree of Souls) o "Tree of Voices" a seconda della traduzione;⭐⭐;14/12/2025
AVTR00032;Avatar;La performance capture usata in Avatar ha migliorato la resa delle espressioni facciali.;Vero/Falso;@Vero, Falso;⭐⭐;14/12/2025
AVTR00033;Avatar;Quale attrice interpreta Neytiri?;4 risposte;A) Michelle Rodriguez, B) Zoe Kravitz, @C) Zoe Saldana, D) Rosario Dawson;⭐⭐;14/12/2025
AVTR00034;Avatar;Quale tema ecologico è presente nel film?;4 risposte;A) Sfruttamento delle risorse naturali, B) Connessione tra esseri viventi, C) Difesa dell'habitat, @D) Tutte le precedenti;⭐⭐;14/12/2025
AVTR00035;Avatar;Scrivi il nome del personaggio umano che guida le operazioni scientifiche su Pandora.;Risposta aperta;@Dr. Grace Augustine;⭐⭐;14/12/2025
AVTR00036;Avatar;Il design delle creature di Pandora è ispirato a fauna reale e immaginaria.;Vero/Falso;@Vero, Falso;⭐⭐;14/12/2025
AVTR00037;Avatar;Quale tecnica subacquea è stata sviluppata per le riprese dei sequel?;4 risposte;A) Riprese in CGI solo in studio, B) Uso esclusivo di modellini, @C) Avanzate tecniche di performance capture subacquea, D) Stop motion;⭐⭐⭐;14/12/2025
AVTR00038;Avatar;Scrivi il nome del personaggio antagonista ricorrente interpretato da Stephen Lang.;Risposta aperta;@Colonel Miles Quaritch;⭐⭐;14/12/2025
AVTR00039;Avatar;La saga di Avatar ha avuto un impatto significativo sul rilancio del cinema in 3D.;Vero/Falso;@Vero, Falso;⭐⭐;14/12/2025
AVTR00040;Avatar;Quale elemento culturale dei Na'vi permette il collegamento diretto tra esseri viventi?;4 risposte;A) Tecnologia avanzata, B) Linguaggio segreto, @C) Queue (braid) che si connette biologicamente, D) Magia;⭐⭐;14/12/2025
AVTR00041;Avatar;Scrivi il nome del pianeta natale degli umani protagonisti (colonia/avamposto).;Risposta aperta;@Non specificato nel film (umani provengono dalla Terra e operano da basi su Pandora);⭐⭐⭐;14/12/2025
AVTR00042;Avatar;Quale casa di produzione ha finanziato e distribuito il primo film?;4 risposte;A) Universal Pictures, B) Warner Bros., @C) 20th Century Fox, D) Paramount;⭐⭐;14/12/2025
AVTR00043;Avatar;Il termine "Eywa" indica la divinità o rete vivente dei Na'vi.;Vero/Falso;@Vero, Falso;⭐⭐;14/12/2025
AVTR00044;Avatar;Scrivi il nome del grande predatore volante leggendario tra i Na'vi.;Risposta aperta;@Toruk (Leonopteryx);⭐⭐;14/12/2025
AVTR00045;Avatar;Quale tecnologia umana permette agli umani di pilotare gli avatar?;4 risposte;A) Interfaccia neurale e collegamento genetico, B) Telepatia, C) Magia, @D) Interfaccia neurale che collega l'operatore all'avatar;⭐⭐;14/12/2025
AVTR00046;Avatar;La saga di Avatar include più sequel pianificati oltre il secondo film.;Vero/Falso;@Vero, Falso;⭐⭐;14/12/2025
AVTR00047;Avatar;Scrivi il nome del personaggio che guida la spedizione scientifica in "Prometheus".;Risposta aperta;@Questa domanda non è pertinente a Avatar (evitare confusione con altre saghe);⭐⭐⭐;14/12/2025
AVTR00048;Avatar;Quale tema sociale è spesso discusso nelle analisi critiche di Avatar?;4 risposte;A) Colonialismo e sfruttamento, B) Ambientalismo, C) Identità culturale, @D) Tutte le precedenti;⭐⭐;14/12/2025
AVTR00049;Avatar;Chi ha curato il design sonoro e gli effetti vocali per le creature di Pandora?;4 risposte;A) Ben Burtt, @B) Sound design team guidato da professionisti del film, C) Hans Zimmer, D) John Williams;⭐⭐⭐;14/12/2025
AVTR00050;Avatar;Chi è il personaggio umano che instaura il primo contatto pacifico con i Na'vi?;4 risposte;A) Colonel Quaritch, B) Parker Selfridge, @C) Jake Sully (tramite avatar), D) Dr. Augustine;⭐⭐;14/12/2025
